{
  "$schema": "https://json-schema.org/draft/2020-12/schema",
  "$id": "casos-extraccion.schema.json",
  "title": "Manifest de casos de extracción — R9 del contrato",
  "description": "Caso positivo y negativo por cada regla que R9 le asigna (R1–R5, R7, R8), con `entrada → salida o error exacto`. Cada caso declara su clase de procedencia: `caso_corpus` se copia del corpus congelado y es trazable byte a byte; `caso_sintetico` declara por qué el corpus no puede aportarlo y cómo se construyó.",
  "x-version": "1",
  "type": "object",
  "additionalProperties": false,
  "required": [
    "version_schema",
    "contrato_sha256",
    "corpus_identidad",
    "reglas_cubiertas",
    "casos",
    "obligatorios"
  ],
  "properties": {
    "version_schema": {
      "const": "1"
    },
    "contrato_sha256": {
      "$ref": "#/$defs/sha256"
    },
    "corpus_identidad": {
      "$ref": "#/$defs/identidad",
      "description": "La proyección canónica del corpus contra el que se resuelven los `origen`."
    },
    "reglas_cubiertas": {
      "type": "array",
      "minItems": 7,
      "maxItems": 7,
      "uniqueItems": true,
      "items": {
        "$ref": "#/$defs/regla"
      },
      "description": "Las siete de R9. Pathspec y baseline git quedan fuera: no son reglas de este contrato."
    },
    "casos": {
      "type": "array",
      "minItems": 14,
      "items": {
        "$ref": "#/$defs/caso"
      }
    },
    "obligatorios": {
      "type": "array",
      "minItems": 5,
      "maxItems": 5,
      "items": {
        "$ref": "#/$defs/obligatorio"
      },
      "description": "AC-13: los defectos que esta fase ya reprodujo. Son cinco identidades y no cuatro defectos, porque el tercero exige `**AC:**` bajo las dos formas de encabezado."
    }
  },
  "$defs": {
    "sha256": {
      "type": "string",
      "pattern": "^[0-9a-f]{64}$"
    },
    "identidad": {
      "type": "string",
      "pattern": "^sha256:[0-9a-f]{64}$"
    },
    "regla": {
      "type": "string",
      "enum": [
        "R1",
        "R2",
        "R3",
        "R4",
        "R5",
        "R7",
        "R8"
      ]
    },
    "slug_de_flujo": {
      "type": "string",
      "pattern": "^(archived/)?[a-z0-9][a-z0-9._-]*$"
    },
    "caso": {
      "type": "object",
      "additionalProperties": false,
      "required": [
        "clase",
        "id",
        "regla",
        "signo",
        "entrada"
      ],
      "properties": {
        "clase": {
          "type": "string",
          "enum": [
            "caso_corpus",
            "caso_sintetico"
          ]
        },
        "id": {
          "type": "string",
          "pattern": "^C[0-9]+$"
        },
        "regla": {
          "$ref": "#/$defs/regla"
        },
        "signo": {
          "type": "string",
          "enum": [
            "positivo",
            "negativo"
          ],
          "description": "AC-11 exige al menos uno de cada por regla."
        },
        "entrada": {
          "type": "string",
          "minLength": 1
        },
        "origen": {
          "$ref": "#/$defs/origen"
        },
        "justificacion": {
          "type": "string",
          "minLength": 1
        },
        "construccion": {
          "type": "string",
          "minLength": 1
        },
        "salida_esperada": {
          "$ref": "#/$defs/salida"
        },
        "error_esperado": {
          "$ref": "#/$defs/error"
        },
        "ambiguo_en_el_corpus": {
          "$ref": "#/$defs/rango",
          "description": "Un rango del MISMO artefacto donde la `entrada` aparece con bytes idénticos, en otro bloque. Se declara cuando existe: es el dato que vuelve comprobable la ambigüedad que AC-12 nombra, y sin él la contención del rango no se puede ejercer sobre datos reales."
        }
      },
      "allOf": [
        {
          "if": {
            "required": [
              "clase"
            ],
            "properties": {
              "clase": {
                "const": "caso_corpus"
              }
            }
          },
          "then": {
            "required": [
              "origen"
            ]
          },
          "else": {
            "required": [
              "justificacion",
              "construccion"
            ]
          }
        },
        {
          "oneOf": [
            {
              "required": [
                "salida_esperada"
              ]
            },
            {
              "required": [
                "error_esperado"
              ]
            }
          ]
        }
      ]
    },
    "origen": {
      "type": "object",
      "additionalProperties": false,
      "required": [
        "flujo",
        "artefacto",
        "task_id",
        "ocurrencia",
        "rango",
        "identidad_lectura"
      ],
      "properties": {
        "flujo": {
          "$ref": "#/$defs/slug_de_flujo"
        },
        "artefacto": {
          "type": "string",
          "enum": [
            "spec.md",
            "plan.md",
            "tasks.md"
          ]
        },
        "task_id": {
          "type": "string",
          "pattern": "^T[0-9]+[A-Za-z]*$"
        },
        "ocurrencia": {
          "type": "integer",
          "minimum": 1
        },
        "rango": {
          "$ref": "#/$defs/rango"
        },
        "identidad_lectura": {
          "$ref": "#/$defs/identidad",
          "description": "El buffer del que se copió el rango. Tiene que ser el mismo del que salió el hash sellado en el manifest de corpus (D4)."
        }
      }
    },
    "rango": {
      "type": "object",
      "additionalProperties": false,
      "required": [
        "inicio",
        "fin"
      ],
      "properties": {
        "inicio": {
          "type": "integer",
          "minimum": 0
        },
        "fin": {
          "type": "integer",
          "minimum": 1
        }
      },
      "description": "Desplazamientos en bytes sobre el artefacto sellado. No es «el texto aparece en algún lugar»: el rango tiene que caer dentro del bloque de la terna declarada."
    },
    "salida": {
      "type": "object",
      "additionalProperties": false,
      "required": [
        "descripcion",
        "valor"
      ],
      "properties": {
        "descripcion": {
          "type": "string",
          "minLength": 1
        },
        "valor": {
          "type": "array",
          "items": {
            "type": "string",
            "minLength": 1
          },
          "description": "Lo que la regla debe producir sobre la entrada, como lista de tokens o ids."
        }
      }
    },
    "error": {
      "type": "object",
      "additionalProperties": false,
      "required": [
        "codigo",
        "descripcion"
      ],
      "properties": {
        "codigo": {
          "type": "string",
          "enum": [
            "rango_invertido",
            "extremo_inexistente",
            "rango_mixto",
            "cobertura_en_conflicto",
            "fila_duplicada",
            "fila_inexistente",
            "duplicado_normativo",
            "consume_no_tipado",
            "task_consumida_inexistente",
            "sin_produce",
            "bloque_global_inexistente",
            "bloque_global_duplicado",
            "bloque_global_ambiguo",
            "ac_inexistente",
            "enfoque_ausente",
            "sin_cobertura"
          ]
        },
        "descripcion": {
          "type": "string",
          "minLength": 1
        }
      }
    },
    "obligatorio": {
      "type": "object",
      "additionalProperties": false,
      "required": [
        "identidad",
        "defecto",
        "descripcion",
        "caso_id"
      ],
      "properties": {
        "identidad": {
          "type": "string",
          "enum": [
            "cubre-continuado-en-lineas-indentadas",
            "cubre-con-el-marcador-solo-al-final",
            "ac-sin-vineta-bajo-encabezado-de-vineta",
            "ac-sin-vineta-bajo-encabezado-de-heading",
            "encabezado-de-task-con-titulo"
          ]
        },
        "defecto": {
          "type": "integer",
          "minimum": 1,
          "maximum": 4
        },
        "descripcion": {
          "type": "string",
          "minLength": 1
        },
        "caso_id": {
          "type": "string",
          "pattern": "^C[0-9]+$"
        },
        "nota": {
          "type": "string",
          "minLength": 1,
          "description": "Lo que el corpus pudo aportar y lo que no, cuando la forma exacta del defecto no existe literalmente en él. AC-13 manda copiar, no inventar: la nota deja escrito el margen."
        }
      }
    }
  }
}
